id,external_id,title,department,location,state,city,job_type,salary_min,salary_max,posted_date,url,description,qualifications,scraped_at,unique_key,company_name,subdomain,portal_slug,sector,ats_type
1705603,157173,Critical Care Stepdown LTAC Registered Nurse / RN,Nursing,US-GA-Decatur,,,,,,2026-03-26T11:32:00,https://ehccareers-emory.icims.com/jobs/jobs/157173/job,,,2026-03-27T08:12:28.305810,5d7eb5504f3b362f,Emory Healthcare,ehccareers-emory.icims.com,ehccareers-emory,university_hospital,icims
1705628,148840,Critical Care Stepdown LTAC Charge Nurse / RN,Nursing,US-GA-Decatur,,,,,,2026-03-26T11:29:00,https://ehccareers-emory.icims.com/jobs/jobs/148840/job,,,2026-03-27T08:12:28.306567,5364673c1fd8c035,Emory Healthcare,ehccareers-emory.icims.com,ehccareers-emory,university_hospital,icims
1705580,161614,Critical Care Stepdown Registered Nurse / RN,Nursing,US-GA-Decatur,,,,,,2026-03-26T11:28:00,https://ehccareers-emory.icims.com/jobs/jobs/161614/job,,,2026-03-27T08:12:28.304916,09b289550512c37f,Emory Healthcare,ehccareers-emory.icims.com,ehccareers-emory,university_hospital,icims
1705620,153278,Unit Charge Nurse Critical Care Stepdown / RN,Nursing,US-GA-Decatur,,,,,,2026-03-26T11:27:00,https://ehccareers-emory.icims.com/jobs/jobs/153278/job,,,2026-03-27T08:12:28.306337,d31560ca79dda173,Emory Healthcare,ehccareers-emory.icims.com,ehccareers-emory,university_hospital,icims
1705579,161634,Unit Charge Nurse Critical Care Stepdown / RN,Nursing,US-GA-Decatur,,,,,,2026-03-26T11:27:00,https://ehccareers-emory.icims.com/jobs/jobs/161634/job,,,2026-03-27T08:12:28.304867,c0395dd851a6cc7e,Emory Healthcare,ehccareers-emory.icims.com,ehccareers-emory,university_hospital,icims
1706206,3393,Plumbing Designer,Engineering - Mechanical,,,,Regular Full-Time,,,2026-03-26T10:59:00,https://careers-hga.icims.com/jobs/jobs/3393/job,"Experienced Plumbing Designer - Milwaukee, WI Join HGA—an award-winning architecture, engineering, interior design, and planning firm—where your technical skills and creative thinking can make a national impact. We’re seeking a Plumbing Designer to join our growing Mechanical team. At HGA, you’ll collaborate with a multidisciplinary group of architects, engineers, and designers on meaningful projects spanning healthcare, science & technology, cultural institutions, corporate campuses, and infrastructure . Every project is an opportunity to shape the built environment using cutting-edge tools and innovative thinking . What You'll Do: Design plumbing systems including domestic water, sanitary waste/vent, medical gas, storm drainage, and specialty systems. Collaborate with team members across disciplines from concept through construction. Contribute to technical documentation, specifications, and code compliance. Leverage BIM/Revit and other digital tools to develop coordinated designs. If you're ready to bring your passion to impactful, high-performance designs that shape communities nationwide—we want to hear from you. In this role you will: Be responsible for plumbing design including calculating building loads for all plumbing systems, select equipment, layout piping, create and edit project details, and write and edit project engineering specifications. Participate in design review meetings and workshops. Support a variety of complex design challenges including conflicting Owner and project requirements, application of different system types, or challenging field conditions. Research design options and document findings for the project team. Assure drawings and designs are in accordance with local codes and design standards. Assist with coordination with architectural and other engineering disciplines as applicable. You will need to have: Bachelor’s degree in architectural engineering, mechanical engineering or related field desired. Up to 2 years of consulting engineering experience with emphasis on plumbing design for healthcare, commercial, municipal, institutional and government facilities. Knowledge of applicable codes and regulations, standard engineering practices, techniques, and procedures. Excellent problem-solving skills. Ability to work on several projects simultaneously and prioritize work. Excellent communication skills. Positive attitude, team player with a collaborative approach. Interest in professional growth and mentoring. Revit, BIM, and Microsoft Office proficiency required. Professional Engineer or Certification recognized by a state licensing board desired. Knowledge in HVAC systems and building controls preferred, but not required. Salary Information: The pay range listed aligns to the geography of the office for which this position is posted . Actual compensation will be based upon work experience, education, licensure requirements and/or skill level and will be finalized at the time of offer. Individuals in this role working more than 24 hours a week on a regular basis are eligible to participate in HGA’s robust benefit programs which include an annual bonus and success sharing bonus program, 401(k) guaranteed contribution, paid parental leave, medical, dental and life insurance plans as well as PTO and short- and long-term disability programs. Salary Range: $35.34/hr (new graduate rate) - $36.54/hr depending on qualifications and experience . Additional Information: HGA is a place where you can do your best work. We believe that enduring, impactful design results from deep insight into the people and passions that animate each unique environment. We value empathy, are fueled by curiosity, and embrace the hard work that leads to innovation. Equally important is our commitment to creating a culture of inclusivity and diversity where we encourage your originality, respect the need for flexibility and work-life balance, and empower your desired career growth. HGA is a national award-winning interdisciplinary design firm rooted in architecture and engineering. Learn more about us here . Application Requirements & Instructions Please submit resume for consideration.",,2026-03-27T07:39:37.232689,6f831f1344021c71,Careers Hga,careers-hga.icims.com,careers-hga,other,icims
1705609,156140,"Allergy, Asthma, Immunology NP / PA",Advanced Practice Providers,US-GA-Atlanta,,,,,,2026-03-26T10:59:00,https://ehccareers-emory.icims.com/jobs/jobs/156140/job,,,2026-03-27T08:12:28.305976,918998a54b847ec3,Emory Healthcare,ehccareers-emory.icims.com,ehccareers-emory,university_hospital,icims
1705608,156588,Nephrology Advanced Practice Provider ACNP / PA,Advanced Practice Providers,US-GA-Atlanta,,,,,,2026-03-26T10:58:00,https://ehccareers-emory.icims.com/jobs/jobs/156588/job,,,2026-03-27T08:12:28.305935,9c3bb6ae29dfc467,Emory Healthcare,ehccareers-emory.icims.com,ehccareers-emory,university_hospital,icims
1705568,162526,Patient Arrival Specialist,Clerical & Administrative,US-GA-Atlanta,,,,,,2026-03-26T10:44:00,https://ehccareers-emory.icims.com/jobs/jobs/162526/job,,,2026-03-27T08:12:28.304212,952ba72cbdc45b26,Emory Healthcare,ehccareers-emory.icims.com,ehccareers-emory,university_hospital,icims
1705574,162096,Patient Arrival Specialist,Clerical & Administrative,US-GA-Lilburn,,,,,,2026-03-26T10:43:00,https://ehccareers-emory.icims.com/jobs/jobs/162096/job,,,2026-03-27T08:12:28.304647,e4ba91f15a0d042f,Emory Healthcare,ehccareers-emory.icims.com,ehccareers-emory,university_hospital,icims
1705592,159268,"Supervisor, Priority Access",Clerical & Administrative,US-GA-Atlanta,,,,,,2026-03-26T10:40:00,https://ehccareers-emory.icims.com/jobs/jobs/159268/job,,,2026-03-27T08:12:28.305446,caa6cca8703775f6,Emory Healthcare,ehccareers-emory.icims.com,ehccareers-emory,university_hospital,icims
1705590,159806,Patient Access Engagement Liaison - MyChart,Clerical & Administrative,US-GA-Atlanta,,,,,,2026-03-26T10:39:00,https://ehccareers-emory.icims.com/jobs/jobs/159806/job,,,2026-03-27T08:12:28.305348,54f190b0cee405f1,Emory Healthcare,ehccareers-emory.icims.com,ehccareers-emory,university_hospital,icims
1705573,162103,Patient Access Priority Engagement Specialist Lead,Clerical & Administrative,US-GA-Atlanta,,,,,,2026-03-26T10:37:00,https://ehccareers-emory.icims.com/jobs/jobs/162103/job,,,2026-03-27T08:12:28.304630,a455288a766648e2,Emory Healthcare,ehccareers-emory.icims.com,ehccareers-emory,university_hospital,icims
1705601,157447,Patient Access Engagement Liaison,Clerical & Administrative,US-GA-Atlanta,,,,,,2026-03-26T10:36:00,https://ehccareers-emory.icims.com/jobs/jobs/157447/job,,,2026-03-27T08:12:28.305778,57185a5a4c526de3,Emory Healthcare,ehccareers-emory.icims.com,ehccareers-emory,university_hospital,icims
1705618,154570,Lead Orthopedic APP Ambulatory Clinic - NP / PA,Advanced Practice Providers,US-GA-Atlanta,,,,,,2026-03-26T09:56:00,https://ehccareers-emory.icims.com/jobs/jobs/154570/job,,,2026-03-27T08:12:28.306180,d82580616200d1af,Emory Healthcare,ehccareers-emory.icims.com,ehccareers-emory,university_hospital,icims
1705576,161890,Infusion Registered Nurse / PRN,Nursing,US-GA-Decatur,,,,,,2026-03-26T09:41:00,https://ehccareers-emory.icims.com/jobs/jobs/161890/job,,,2026-03-27T08:12:28.304751,3c109cbf9fc0a161,Emory Healthcare,ehccareers-emory.icims.com,ehccareers-emory,university_hospital,icims
1705589,159820,RN / Outpatient Cardiology,Nursing,US-GA-Atlanta,,,,,,2026-03-26T09:23:00,https://ehccareers-emory.icims.com/jobs/jobs/159820/job,,,2026-03-27T08:12:28.305327,a32304f70d6a7b59,Emory Healthcare,ehccareers-emory.icims.com,ehccareers-emory,university_hospital,icims
1705577,161715,Patient Access Consultant,Business Operations,US-GA-Atlanta,,,,,,2026-03-26T08:48:00,https://ehccareers-emory.icims.com/jobs/jobs/161715/job,,,2026-03-27T08:12:28.304811,1f868c3be08a0ca2,Emory Healthcare,ehccareers-emory.icims.com,ehccareers-emory,university_hospital,icims
1705572,162222,Maintenance Mechanic,Facility Support and Building Maintenance,US-GA-Atlanta,,,,,,2026-03-26T08:46:00,https://ehccareers-emory.icims.com/jobs/jobs/162222/job,,,2026-03-27T08:12:28.304532,e017044231a7aaf7,Emory Healthcare,ehccareers-emory.icims.com,ehccareers-emory,university_hospital,icims
1705616,155049,Imaging Services Assistant,Imaging & Radiology,US-GA-Atlanta,,,,,,2026-03-26T07:50:00,https://ehccareers-emory.icims.com/jobs/jobs/155049/job,,,2026-03-27T08:12:28.306133,04707c0227e8f1cc,Emory Healthcare,ehccareers-emory.icims.com,ehccareers-emory,university_hospital,icims
1706686,31145850,(Sr.) Financial Planning & Analysis Manager,,China - Shanghai,,,Full time,,,2026-03-26T00:00:00,https://abbott.wd5.myworkdayjobs.com/abbottcareers/job/China---Shanghai/XMLNAME--Sr--Financial-Planning---Analysis-Manager_31145850,"JOB DESCRIPTION: Major Responsibilities 主要职责 Strongly support commercial team to provide financial insights and strategies for commercial team. Month end closing, reporting, and coordinate with shared finance service to ensure the accuracy of information. In conjunction with the management team, develop all Plan LBE and other forecasts ensuring reasonableness on an absolute, as well as, performance basis. Help commercial team to set up annual expenses target of sales rep/ supervisor and manager, and track actuals Provide support to R&D center and Customer experience center Balance sheet projection, reconciliation and ensure forecast accuracy Ad hoc assignment. to meet business initiatives, planning and reporting requirements. Requirement(education, background,…etc) 要求 Bachelor’s degree in finance, Business and/or economics CPA is preferred; 5+ years experiences with MNCs at FP&A positions; With strong analytical mind and technique for planning and execution. Power BI experience is highly preferred. Pro-active mindset; willingness to learn and be a fast learner. Excellent intercultural communication skill and good leadership. Good oral and written communication skills in both English and mandarin. The base pay for this position is N/A In specific locations, the pay range may vary from the range posted. JOB FAMILY: Financial Planning and Analysis DIVISION: LOCATION: China > Shanghai : 388 W. Nanjing Road, Ciros Plaza ADDITIONAL LOCATIONS: WORK SHIFT: Standard TRAVEL: Not specified MEDICAL SURVEILLANCE: Not Applicable SIGNIFICANT WORK ACTIVITIES: Not Applicable",,2026-03-26T07:37:44.509681,d935408081af97b7,ABBOTT,abbott,abbott,,workday
1706250,R-041255,"Pharmacy Tech (Tech I), 6-Week Training Program, Rotating Shift, Pharmacy",,"Rockville, MD",,,Full time,19.64,25.65,2026-03-26T00:00:00,https://adventisthealthcare.wd1.myworkdayjobs.com/AdventistHealthCareCareers/job/Rockville-MD/Pharmacy-Tech--Tech-I---6-Week-Training-Program--Rotating-Shift--Pharmacy_R-041255,"Shady Grove Medical Center If you are a current Adventist HealthCare employee, please click this link to apply through your Workday account. Shady Grove Medical Center seeks to hire an experienced Pharmacy Technician for our Pharmacy department who will embrace our mission to extend God’s care through the ministry of physical, mental, and spiritual healing. As a Pharmacy Technician you will: • Prepare and deliver medication to patient care units and restock automated dispensing units • Maintain accurate inventory of medications and supplies by performing inventory management cycle counts and perform patient care unit inspections with electronic documentation • Assess need for and repackage oral solid and liquid medication for dispensing • Demonstrate a positive attitude on patient safety, lifelong learning, professionalism, and customer experience • Perform additional duties as assigned Qualifications include: • High school diploma or GED/equivalent • Required: Licensure as Pharmacy Technician by the Maryland Board of Pharmacy • Strongly Preferred: 1 year of pharmacy experience • Preferred: Previous experience with electronic medical records (e.g. Cerner, EPIC), automated medication management (Pyxis, Omnicell, BD Logistics) Work Schedule: Work Schedule: This 6-week training program is designed to introduce Pharmacy Technicians to hospital based practice and will be a combination of clinical and technical competence including: Classroom Lecture On-Site Training Unit dose training IV Room training Supervised shifts Final exam and performance review & evaluation Location & Schedule: Weeks 1 & 2 at Adventist HealthCare Support Center in Gaithersburg, MD Weeks 3-6 at Shady Grove Medical Center, Rockville, MD Training program is a Monday - Friday 8 hour shift from 9am-5pm **Post 6-week training program, the position becomes a standard full-time rotating shift position. Upon hire you will complete a six-week Pharmacy Technician Training Program, to develop clinical and technical competence in health-system pharmacy through a variety of modalities, including classroom, simulation and application of learning in a hospital pharmacy setting. Demonstrated competence will include clinical skills (medication knowledge and pharmacy calculations), technical skills (Cerner, Logistics and Pyxis), and interpersonal skills (building relationships with other healthcare providers, patients, and team members). Pay Range: $19.64 - $25.65 If the salary range is listed as $0 or if the position is Per Diem (with a fixed rate), salary discussions will take place during the screening process. Under the Fair Labor Standards Act (FLSA), this position is classified as: United States of America (Non-Exempt) At Adventist HealthCare our job is to care for you. We do this by offering: Work life balance through nonrotating shifts Recognition and rewards for professional expertise Free Employee parking Medical, Prescription, Dental, and Vision coverage for employees and their eligible dependents effective on your date of hire Employer-paid Short & Long-Term Disability, Basic Life Insurance and AD&D, (short-term disability buy-up available) Paid Time Off Employer retirement contribution and match after 1-year of eligible employment with a 3-year vesting period Voluntary benefits include flexible spending accounts, legal plans, and life, pet, auto, home, long term care, and critical illness & accident insurance Subsidized childcare at participating childcare centers Tuition Reimbursement Employee Assistance Program (EAP) support As a faith-based organization, with over a century of caring for the communities in the Maryland area, Adventist HealthCare has earned a reputation for high-quality, compassionate care. Adventist HealthCare was the first and is the largest healthcare provider in Montgomery County. If you want to make a difference in someone’s life every day, consider a position with a team of professionals who are doing just that, making a difference. Join the Adventist HealthCare team today, apply now to be considered! COVID-19 Vaccination Adventist HealthCare strongly recommends all applicants to be fully vaccinated for COVID-19 before commencing employment. Applicants may be required to furnish proof of vaccination. Tobacco and Drug Statement Tobacco use is a well-recognized preventable cause of death in the United States and an important public health issue. In order to promote and maintain a healthy work environment, Adventist HealthCare will not hire applicants for employment who either state that they are nicotine users or who test positive for nicotine and drug use. While some jurisdictions, including Maryland, permit the use of marijuana for medical purposes, marijuana continues to be classified as an illegal drug under the federal Controlled Substances Act.  As a result, medical marijuana use will not be accepted as a valid explanation for a positive drug test result. Adventist HealthCare will withdraw offers of employment to applicants who test positive for Cotinine (nicotine) and marijuana. Those testing positive are given the opportunity to re-apply in 90 days, if they can truthfully attest that they have not used any nicotine products in the past ninety (90) days and successfully pass follow-up testing. (""Nicotine products"" include, but are not limited to: cigarettes, cigars, pipes, chewing tobacco, e-cigarettes, vaping products, hookah, and nicotine replacement products (e.g., nicotine gum, nicotine patches, nicotine lozenges, etc.). Equal Employment Opportunity Adventist HealthCare is an Equal Opportunity/Affirmative Action Employer. We are committed to attracting, engaging, and developing the best people to cultivate our mission-centric culture. Our goal is to have a welcoming, equitable, and safe place to work and grow for all employees, no matter their background. AHC does not discriminate in employment opportunities or practices on the basis of race, ethnicity, color, religion, sex, national origin, age, disability, sexual orientation, gender identity, pregnancy and related medical conditions, protected veteran status, or any other characteristic protected by law. Adventist HealthCare will make reasonable accommodations for applicants with disabilities, in accordance with applicable law.  Adventist HealthCare is a religious organization as defined under applicable law; however, it will endeavor to provide reasonable accommodations for applicants’ religious beliefs. Applicants who wish to request accommodations for disabilities or religious belief should contact the Support Center HR Office.",,2026-03-27T07:37:25.304282,d44dc02a8a3582ae,ADVENTISTHEALTHCARE,adventisthealthcare,adventisthealthcare,,workday
1706249,R-041257,"Student Pharmacy Intern, Variable Part-Time,  Pharmacy",,"Rockville, MD",,,Part time,19.64,25.65,2026-03-26T00:00:00,https://adventisthealthcare.wd1.myworkdayjobs.com/AdventistHealthCareCareers/job/Rockville-MD/Student-Pharmacy-Intern--Variable-Part-Time---Pharmacy_R-041257-1,"Shady Grove Medical Center If you are a current Adventist HealthCare employee, please click this link to apply through your Workday account. Shady Grove Medical Center seeks to hire a Pharmacy Intern who will embrace our mission to extend God’s care through the ministry of physical, mental and spiritual healing. As a Pharmacy Intern you will: • Perform Medication History patient interview and documentation • Perform Discharge Patient Counseling. • Maintain an accurate inventory of medications and supplies by performing inventory management cycle counts and Pyxis unit inspections with electronic documentation. • Prepare and delivers medication to Pyxis. • Assess need for and batches/prepacks IV, oral and solid medications for dispensing. • Perform sterile compounding according to USP 797 and USP 795 including electronic documentation. • Additional duties as assigned Qualified candidates will possess: • Required: Successful completion first year of Pharmacy school requirements. • Preferred: Pharmacy Technician or Intern work experience specifically with automated distribution systems, decentralized pharmacy services and medication history documentation. • Required: Registered as Pharmacy Intern with the Maryland Board of Pharmacy Work Schedule: Employment Type: Variable Part-time Hours per Week: 8 hrs/week Typical Daily Schedule: Hours Vary Shift Type: Day / Evening /Rotating Weekend Requirements: Required every other weekend rotation Holiday Requirements: Required/On-call/Follow company holiday calendar On-Call: no Shift Differential Eligible: Yes Additional Details: Specialized responsibilities as Pharmacy Student Intern to include but not limited to Discharge Patient Counseling and Medication History Documentation.  In addition to these specialized responsibilities, the Pharmacy Student Intern will also be able to function as and perform all duties of a Pharmacy Technician. Pay Range: $19.64 - $25.65 If the salary range is not displayed or if the position is Per Diem (with a fixed rate), salary discussions will take place during the screening process. Under the Fair Labor Standards Act (FLSA), this position is classified as: United States of America (Non-Exempt) At Adventist HealthCare our job is to care for you. We do this by offering: Work life balance through nonrotating shifts Recognition and rewards for professional expertise 403(b) retirement plan Free Employee parking Employee Assistance Program (EAP) support As a faith-based organization, with over a century of caring for the communities in the Maryland area, Adventist HealthCare has earned a reputation for high-quality, compassionate care. Adventist HealthCare was the first and is the largest healthcare provider in Montgomery County. If you want to make a difference in someone’s life every day, consider a position with a team of professionals who are doing just that, making a difference. Join the Adventist HealthCare team today, apply now to be considered! COVID-19 Vaccination Adventist HealthCare strongly recommends all applicants to be fully vaccinated for COVID-19 before commencing employment. Applicants may be required to furnish proof of vaccination. Tobacco and Drug Statement Tobacco use is a well-recognized preventable cause of death in the United States and an important public health issue. In order to promote and maintain a healthy work environment, Adventist HealthCare will not hire applicants for employment who either state that they are nicotine users or who test positive for nicotine and drug use. While some jurisdictions, including Maryland, permit the use of marijuana for medical purposes, marijuana continues to be classified as an illegal drug under the federal Controlled Substances Act.  As a result, medical marijuana use will not be accepted as a valid explanation for a positive drug test result. Adventist HealthCare will withdraw offers of employment to applicants who test positive for Cotinine (nicotine) and marijuana. Those testing positive are given the opportunity to re-apply in 90 days, if they can truthfully attest that they have not used any nicotine products in the past ninety (90) days and successfully pass follow-up testing. (""Nicotine products"" include, but are not limited to: cigarettes, cigars, pipes, chewing tobacco, e-cigarettes, vaping products, hookah, and nicotine replacement products (e.g., nicotine gum, nicotine patches, nicotine lozenges, etc.). Equal Employment Opportunity Adventist HealthCare is an Equal Opportunity/Affirmative Action Employer. We are committed to attracting, engaging, and developing the best people to cultivate our mission-centric culture. Our goal is to have a welcoming, equitable, and safe place to work and grow for all employees, no matter their background. AHC does not discriminate in employment opportunities or practices on the basis of race, ethnicity, color, religion, sex, national origin, age, disability, sexual orientation, gender identity, pregnancy and related medical conditions, protected veteran status, or any other characteristic protected by law. Adventist HealthCare will make reasonable accommodations for applicants with disabilities, in accordance with applicable law.  Adventist HealthCare is a religious organization as defined under applicable law; however, it will endeavor to provide reasonable accommodations for applicants’ religious beliefs. Applicants who wish to request accommodations for disabilities or religious belief should contact the Support Center HR Office.",,2026-03-27T07:37:25.304196,fc1f43313b06bde1,ADVENTISTHEALTHCARE,adventisthealthcare,adventisthealthcare,,workday
1706198,330394,Federal Project Manager III - Oracle Health (EHR Pre & Post Go-live Readiness),,United States,,,,,,2026-03-26T00:00:00,https://eeho.fa.us2.oraclecloud.com/hcmUI/CandidateExperience/en/sites/CX_1/job/330394,,,2026-03-27T07:19:57.998145,623bc6c9a3f27488,Oracle (EEHO),eeho,eeho,,oracle
