id,external_id,title,department,location,state,city,job_type,salary_min,salary_max,posted_date,url,description,qualifications,scraped_at,unique_key,company_name,subdomain,portal_slug,sector,ats_type
1674038,7990,Digital Marketing Manager,Marketing (apetito),UK-Wiltshire-Trowbridge,,,Fixed-Term (Full-Time),,,2026-09-04T00:00:00,https://careers-apetito.icims.com/jobs/jobs/7990/job,"Fixed term contract for 12 months Join our rapidly growing business in a role as Digital Marketing Manager (FTC) focusing primarily on the digital marketing and paid digital strategies to support B2B’s commercial growth, as well as managing the apetito.co.uk website strategy. As a digital marketing specialist, your role will be pivotal in enhancing our online presence. Reporting to the Head of Proposition & Marketing, you will play a key role in contributing to the company’s ambitious growth targets and driving our online brand visibility. This is a fantastic opportunity for a collaborative, analytical and creative marketeer to work within a supportive, experienced and passionate team. This role is based in Trowbridge and you will be required to work on-site at least 3 days per week.",,2026-03-28T07:28:46.930010,f8adcf7f0c76edf7,Careers Apetito,careers-apetito.icims.com,careers-apetito,other,icims
1674037,8020,Senior PR Executive,PR / Internal Comms,UK-Wiltshire-Trowbridge,,,Permanent (Full-Time),,,2026-06-04T00:00:00,https://careers-apetito.icims.com/jobs/jobs/8020/job,"As Senior PR Executive, you will play a key role in delivering high-quality, impactful PR activity that strengthens apetito’s reputation across our priority markets. You will need a high degree of autonomy and judgement, and be trusted to lead the delivery of high-profile PR activity under the direction of the PR Manager. Sitting within the central Brand & Communications team, you will work closely with colleagues across the business and external partners to bring our stories to life, ensuring our voice is credible, consistent and values-led. You will also act as a role model within the PR team, helping to maintain high standards and support the development of others. Most importantly, you will help share how apetito and Wiltshire Farm Foods are making a real difference to customers, communities and colleagues every single day. At apetito | Wiltshire Farm Foods, we are on an ambitious journey. With bold growth targets ahead, how we tell our story and protect our reputation will play a critical role in helping us succeed. We are looking for someone with experience in PR and media relations, able to craft compelling stories as well as demonstrate the commercial impact of PR delivery. This role is based in our Trowbridge head office and you will need to be on site at least 3 days per week.",,2026-03-28T07:28:46.929686,7cd3650fc4772070,Careers Apetito,careers-apetito.icims.com,careers-apetito,other,icims
1674035,8027,Customer Delivery Driver/Picker,Wiltshire Farm Foods (Drivers),UK-Hampshire-Newbury,,,Permanent (Full-Time),13.05,,2026-03-31T00:00:00,https://careers-apetito.icims.com/jobs/jobs/8027/job,"This position is working 40 hours per week, any 5 in 6 days including bank holidays. Our drivers are the face of our business and their interaction with our customers is crucial to our success. In this role you will be delivering frozen Wiltshire Farm Foods meals and bringing sunshine to our customers doors (no matter what the weather is doing). As such, you will enjoy meeting people and always be willing to go above and beyond what is expected. Along with this, you will be working within our coldstore that runs at a chilly -20ºc. Protective clothing designed to deal with this temperature will be provided along with breaks to warm up and have a hot drink when necessary. You will need to work as part of the wider team always looking to help out the office team. We encourage movement between teams to provide flexibility, job satisfaction, personal development and knowledge of the whole business. We’re passionate about Making a Real Difference to people’s lives with delicious and nutritious meals for everyone to enjoy. View our latest TV ad here: https://www.wiltshirefarmfoods.com/blog/our-new-tv-ad-launches £13.05 per hour(£13.45 per hour from 1 May 2026) + bonus + company benefits.",,2026-03-28T07:28:46.929444,aaf28f01a43c6fc3,Careers Apetito,careers-apetito.icims.com,careers-apetito,other,icims
1706199,8019,Technical Manager,Other,UK-Wiltshire-Trowbridge,,,Permanent (Full-Time),,,2026-03-30T00:00:00,https://careers-apetito.icims.com/jobs/jobs/8019/job,"Technical Manager – Be at the Heart of a Major New Investment Join apetito at a transformational moment in our journey. Having exceeded £260m turnover, we are now investing over £100m in building a state‑of‑the‑art manufacturing facility —a major milestone that will support our continued growth and innovation in food manufacturing. As our new Technical Manager, you’ll play a pivotal role not only in leading food safety and quality during the operational phase, but also in shaping the future of the site as it comes to life. This includes valuable involvement throughout the installation and commissioning of the new facility—an opportunity few roles can offer. What You’ll Be Doing While construction is underway, you’ll be based in our existing kitchen, located just a short walk from the new site. Reporting to the Group Technical Manager, you will: Work closely with the current Site Technical Manager to support the team with a strong focus on systems, governance, and compliance Build a deep understanding of our complex operation—managing hundreds of ingredients and materials that go into producing hundreds of delicious, nutritious recipes Begin partnering with the project team as the new build progresses, ensuring that food safety and quality standards are fully embedded throughout installation and commissioning Recruit, develop, and inspire your new team, building strong relationships across the site Design and implement robust quality systems to support the new kitchen’s launch Ensure we achieve food registration and secure an AA grade against the BRCGS Global Standard for Food Safety at the earliest opportunity",,2026-03-27T07:39:37.228299,77b3272fdf5382bb,Careers Apetito,careers-apetito.icims.com,careers-apetito,other,icims
1674036,8026,Customer Service Advisor,Wiltshire Farm Foods,UK-Devon-South Molton,,,Permanent (Full-Time),1.0,2026.0,2026-03-30T00:00:00,https://careers-apetito.icims.com/jobs/jobs/8026/job,"This role is working 30 hours per week, any 4 in 6 days The role of our Customer Services Advisor is critical to the success of our business. Our customers are predominantly elderly and rely upon our office teams to take their orders over the phone or via the internet. The defining characteristics of our Customer Services Advisors are that they’re organised and efficient. However, apart from the technical skills that are required with the role, the most important attributes are that we demonstrate empathy, patience, kindness, friendliness, care and warmth to all our customers. The role involves the taking of customer orders and also the making of outbound courtesy calls. These calls are particularly important as many customers live alone and the phone calls they receive are often the only contact they may have in a single day. As such, many customers become very attached to their “friends” at Wiltshire Farm Foods. Wiltshire Farm Foods supplies frozen meal solutions direct to the consumer. We have a cold store to accommodate the stock necessary to be able to be able to deliver to our customers each week. The ultimate goal is to provide a service to our customers that exceed expectations while at the same time continuously improving efficiencies. £13.05 per hour (£13.45 per hour from 1st May 2026) + bonus + company benefits.",,2026-03-28T07:28:46.929606,37f3fce6263337b5,Careers Apetito,careers-apetito.icims.com,careers-apetito,other,icims
1706200,8018,Customer Delivery Driver/Picker,Wiltshire Farm Foods (Drivers),UK-Lancashire-Accrington,,,Permanent (Part-Time),1.0,2026.0,2026-03-29T00:00:00,https://careers-apetito.icims.com/jobs/jobs/8018/job,"This position is working 24 hours per week, any 3 in 6 days including bank holidays. Our drivers are the face of our business and their interaction with our customers is crucial to our success. In this role you will be delivering frozen Wiltshire Farm Foods meals and bringing sunshine to our customers doors (no matter what the weather is doing). As such, you will enjoy meeting people and always be willing to go above and beyond what is expected. Along with this, you will be working within our coldstore that runs at a chilly -20ºc. Protective clothing designed to deal with this temperature will be provided along with breaks to warm up and have a hot drink when necessary. You will need to work as part of the wider team always looking to help out the office team. We encourage movement between teams to provide flexibility, job satisfaction, personal development and knowledge of the whole business. We’re passionate about Making a Real Difference to people’s lives with delicious and nutritious meals for everyone to enjoy. View our latest TV ad here: https://www.wiltshirefarmfoods.com/blog/our-new-tv-ad-launches £13.05 per hour (£13.45 per hour from 1st May 2026) + bonus + company benefits.",,2026-03-27T07:39:37.228479,8547ffdd8ef07aba,Careers Apetito,careers-apetito.icims.com,careers-apetito,other,icims
1642655,162941,Clinical Risk Manager,Nursing,US-GA-Atlanta,,,,,,2026-03-27T19:45:00,https://ehccareers-emory.icims.com/jobs/jobs/162941/job,,,2026-03-28T07:55:01.136097,0acb3be9307971f0,Emory Healthcare,ehccareers-emory.icims.com,ehccareers-emory,university_hospital,icims
1642664,161419,Data Analyst III - Transplant,Information Technology,US-GA-Atlanta,,,,,,2026-03-27T16:24:00,https://ehccareers-emory.icims.com/jobs/jobs/161419/job,,,2026-03-28T07:55:01.137054,81cf2d625745af86,Emory Healthcare,ehccareers-emory.icims.com,ehccareers-emory,university_hospital,icims
1642656,162937,Pharmacy Technician,Pharmacy,US-GA-Atlanta,,,,,,2026-03-27T15:06:00,https://ehccareers-emory.icims.com/jobs/jobs/162937/job,,,2026-03-28T07:55:01.136121,751be2c2d2ccac99,Emory Healthcare,ehccareers-emory.icims.com,ehccareers-emory,university_hospital,icims
1642650,163142,"Director, Patient Care Service / Physician Division",Nursing,US-GA-Atlanta,,,,,,2026-03-27T14:46:00,https://ehccareers-emory.icims.com/jobs/jobs/163142/job,,,2026-03-28T07:55:01.135953,c02462b85df9605f,Emory Healthcare,ehccareers-emory.icims.com,ehccareers-emory,university_hospital,icims
1674039,3397,Project Architect,Architecture,,,,Regular Full-Time,108200.0,130000.0,2026-03-27T14:43:00,https://careers-hga.icims.com/jobs/jobs/3397/job,"Shape the future of healthcare design with HGA! Project Architect – Healthcare in Sacramento, San Francisco, Santa Monica or San Diego, CA HGA, a leading architectural, engineering, and planning firm, is seeking a talented and driven Project Architect to join our growing healthcare practice group in Northern and Southern California. We’re looking for someone with strong communication, presentation, time management, and interpersonal skills who thrives in a collaborative environment and is passionate about advancing healthcare design. In this role, you’ll work closely with Senior Designers, Project Managers, and other Project Architects to develop innovative and technically sound design solutions. You’ll lead the creation of detailed documentation while maintaining our firm’s high standards for design quality and client service. What You’ll Do: Lead the development of construction documents and ensure design intent is accurately carried through. Translate complex project goals into creative and functional design solutions. Collaborate across disciplines to coordinate architectural and engineering systems. Participate in client meetings and maintain strong relationships with key stakeholders. Ensure project milestones and deadlines are met with attention to detail and quality. Why HGA? Collaborative Culture: be part of a firm known for its integrated, cross-disciplinary teamwork and strong design ethos; Professional Growth: access to mentorship, continuing education, and leadership opportunities; and Meaningful Work: contribute to impactful healthcare projects that improve patient outcomes and shape the future of care in Calfornia. In this role you will: Design and u nderstand and contribute to the project's design philosophy. Provide major input in developing design and building performance strategies and convey these effectively to team members. Lead project teams to develop complete document sets based on the project phase. Provide technical design input and solutions to project challenges, supporting the overall design concept. Oversee technical design efforts, detailed design development, project coordination, and quality control during all project phases, collaborating closely with the Senior Designer. Execute applicable agency review analysis (accessibility, zoning, life-safety, etc.). Actively collaborate with and coordinate the work of consultants and knowledge resources to ensure project deliverables are coordinated, integrated, and support the design concept and performance goals. Set an example for team effort through the spirit of cooperation while directing, organizing, and mentoring junior staff. C ontribute to the preparation of design documents and lead the detailed development of construction documents during all project phases. Ensure complete, accurate, and coordinated project documentation. Oversee and perform construction administration duties, including reviewing shop drawings, material samples, RFI’s, RFP’s, and change orders for conformance with design. What you will need to have: Bachelor’s degree in Architecture California Architectural Licensure required LEED accreditation preferred 10+ years of experience, including work on small to large-scale projects. Understanding of the healthcare industry, especially in areas of clinical innovation, operational improvement, planning, and strategic positioning for complex hospital systems Deep understanding of healthcare programming, codes, and technical detailing Strong leadership and collaboration skills in team environments Proficiency in Revit required; experience with AutoCAD, SketchUp, Enscape, and other graphic tools desired. Expertise with project management software and Microsoft Office Suite products needed Excellent communication, presentation, and time management skills Experience with Lean and Evidence-based design is a plus. Experience with alternative delivery methods (IPD, Design Build, IFOA) preferred Salary Information: The pay range listed aligns to the geography of the office for which this position is posted. Actual compensation will be based upon work experience, education, licensure requirements and/or skill level and will be finalized at the time of offer. Individuals in this role working more than 24 hours a week on a regular basis are eligible to participate in HGA’s robust benefit programs which include an annual bonus and success sharing bonus program, 401(k) guaranteed contribution, paid parental leave, medical, dental and life insurance plans as well as PTO and short- and long-term disability programs. Salary Range: $108,200 - $130,000 depending on location (SAC, SF, LA or SD), qualifications and experience. Additional Information: At HGA, you’ll do the best work of your career. We design with impact by diving deep into the people and passions that shape every place. Empathy fuels us, curiosity drives us, and meaningful work leads to innovation. We celebrate individuality, embrace flexibility, and thrive together in the office three days a week. Join our nationally recognized, award-winning team of architects, engineers, and interior designers — help us shape what’s next. Learn more about us here . Application Requirements & Instructions Please submit resume and portfolio for consideration.",,2026-03-28T07:28:46.933759,55acca270727b71c,Careers Hga,careers-hga.icims.com,careers-hga,other,icims
1674040,3395,Project Manager,Architecture,,,,Regular Full-Time,107000.0,131200.0,2026-03-27T14:15:00,https://careers-hga.icims.com/jobs/jobs/3395/job,"Join HGA and learn what passion for design really means in spaces that touch people's lives! Locations: Sacramento, San Fransisco, Santa Monica, or San Diego, CA Bring your experience and design expertise to an innovative architecture, engineering and interior design firm dedicated to designing exceptional spaces that inspire and transform communities. We are looking for a talented, design-sensitive, and ambitious Project Manager to join our California healthcare architecture teams and help shape the future of healthcare design. In this role, you will be an integral member of our project teams, contributing at every stage of the design process. Our practice encompasses a broad array of project types and scales, so versatility and adaptability to various collaborative design team settings are essential. Why HGA? Collaborative Culture: be part of a firm known for its integrated, cross-disciplinary teamwork and strong design ethos; Professional Growth: access to mentorship, continuing education, and leadership opportunities; and Meaningful Work: contribute to impactful projects that improve and shape the future architectural design. In this role you will: Collaborate with Principal in evaluation of project requirements and help to negotiate an acceptable owner-architect agreement including the fee, scope, and time schedule. Demonstrate task-focused mastery of project scope, schedule, budget and profitability. Complete projects on schedule, within budget and with maximum client satisfaction. Manage a program of multiple projects and associated client relationships effectively. Negotiate critical issues with Owner and Contractor as well as Architects, Engineers and Specialty Consultants within HGA and of other organizations and firms. Supervise the production of architectural construction documents for multiple small renovation projects. Lead a full-service architectural and engineering team, using past experience and technical knowledge to efficiently deliver quality documents, specifications, reports and cost estimates, keeping in mind schedules/budgets and provides coaching/communication as appropriate with team leaders and/or team members who are responsible for work flow/timelines, etc. Develop discipline cost and work-hour budgets for each project and monitor project costs, completion status against budget schedules/timelines. Oversee all correspondence and pertinent documents, making sure they are accurate; sign or obtain signatures and seek legal counsel as appropriate. Coordinate review and evaluation of contractor bids and work with Principal so that award recommendation can be submitted to owner. Provide day-to-day leadership in the absence of and as delegated by the Principal and/or Practice Group Leader keeping lines of communication open with all office management leaders and assist with preparation of client billings prior to submittal for signature. Collaborate with Practice Group Leader as requested in the marketing of projects including development of proposals and possible participation in client interviews. What you will need to have: Bachelor’s or master’s degree in architecture or related field Licensed professional preferred 8-10 years of project management experience honed on increasingly more complex projects Demonstrated skill in working on multiple smaller-sized to mid-sized, challenging projects simultaneously Exceptional interpersonal skills and the ability to communicate clearly with team members and clients and lead discussions on project budgets and management of project delivery Proficiency with industry accepted software and Microsoft Office products is needed, experience with Project Management software (Vision, Microsoft Project) is beneficial Salary Information: The pay range listed aligns to the geography of the office for which this position is posted. Actual compensation will be based upon work experience, education, licensure requirements and/or skill level and will be finalized at the time of offer. Individuals in this role working more than 24 hours a week on a regular basis are eligible to participate in HGA’s robust benefit programs which include an annual bonus and success sharing bonus program, 401(k) guaranteed contribution, paid parental leave, medical, dental and life insurance plans as well as PTO and short- and long-term disability programs. Salary Range: $107,000 - $131,200 depending on location (SAC, SF, LA or SD), qualifications and experience. Additional Information: At HGA, you’ll do the best work of your career. We design with impact by diving deep into the people and passions that shape every place. Empathy fuels us, curiosity drives us, and meaningful work leads to innovation. We celebrate individuality, embrace flexibility, and thrive together in the office three days a week. Join our nationally recognized, award-winning team of architects, engineers, and interior designers — help us shape what’s next. Learn more about us here . Application Requirements & Instructions Please submit resume and portfolio for consideration.",,2026-03-28T07:28:46.933800,3a895e287e032141,Careers Hga,careers-hga.icims.com,careers-hga,other,icims
1642654,162944,Administrative Assistant,Clerical & Administrative,US-GA-Atlanta,,,,,,2026-03-27T14:08:00,https://ehccareers-emory.icims.com/jobs/jobs/162944/job,,,2026-03-28T07:55:01.136080,04f77be7a6e66475,Emory Healthcare,ehccareers-emory.icims.com,ehccareers-emory,university_hospital,icims
1642661,161968,Food & Nutrition Associate Sanitation,Food Services,US-GA-Decatur,,,,,,2026-03-27T10:28:00,https://ehccareers-emory.icims.com/jobs/jobs/161968/job,,,2026-03-28T07:55:01.136789,eab2c8f1868bf68c,Emory Healthcare,ehccareers-emory.icims.com,ehccareers-emory,university_hospital,icims
1642662,161966,Food & Nutrition Associate (sanitation),Food Services,US-GA-Decatur,,,,,,2026-03-27T10:27:00,https://ehccareers-emory.icims.com/jobs/jobs/161966/job,,,2026-03-28T07:55:01.136840,ba5553e0995533b8,Emory Healthcare,ehccareers-emory.icims.com,ehccareers-emory,university_hospital,icims
1642663,161641,Phlebotomy Tech,Laboratory,US-GA-Atlanta,,,,,,2026-03-27T10:13:00,https://ehccareers-emory.icims.com/jobs/jobs/161641/job,,,2026-03-28T07:55:01.136949,503834faacaa4330,Emory Healthcare,ehccareers-emory.icims.com,ehccareers-emory,university_hospital,icims
1642657,162915,Patient Access Specialist,Clerical & Administrative,US-GA-Hiawassee,,,,,,2026-03-27T04:20:00,https://ehccareers-emory.icims.com/jobs/jobs/162915/job,,,2026-03-28T07:55:01.136149,baca88f23caaab2c,Emory Healthcare,ehccareers-emory.icims.com,ehccareers-emory,university_hospital,icims
1642659,162865,"Supervisor, Operations",Clerical & Administrative,US-GA-Atlanta,,,,,,2026-03-27T04:18:00,https://ehccareers-emory.icims.com/jobs/jobs/162865/job,,,2026-03-28T07:55:01.136206,445e7963c5c8db9f,Emory Healthcare,ehccareers-emory.icims.com,ehccareers-emory,university_hospital,icims
1642658,162880,Patient Services Coordinator One,Clerical & Administrative,US-GA-Atlanta,,,,,,2026-03-27T04:17:00,https://ehccareers-emory.icims.com/jobs/jobs/162880/job,,,2026-03-28T07:55:01.136181,ea25326afab9e590,Emory Healthcare,ehccareers-emory.icims.com,ehccareers-emory,university_hospital,icims
1642653,163004,Unit Clerk,Clerical & Administrative,US-GA-Atlanta,,,,,,2026-03-27T04:15:00,https://ehccareers-emory.icims.com/jobs/jobs/163004/job,,,2026-03-28T07:55:01.136062,c293ef6779441290,Emory Healthcare,ehccareers-emory.icims.com,ehccareers-emory,university_hospital,icims
1642652,163071,Call Center Associate,Food Services,US-GA-Johns Creek,,,,,,2026-03-27T04:14:00,https://ehccareers-emory.icims.com/jobs/jobs/163071/job,,,2026-03-28T07:55:01.136041,2f801e7a2fa68a6d,Emory Healthcare,ehccareers-emory.icims.com,ehccareers-emory,university_hospital,icims
1642660,162442,Dining Services Associate,Food Services,US-GA-Atlanta,,,,,,2026-03-27T04:13:00,https://ehccareers-emory.icims.com/jobs/jobs/162442/job,,,2026-03-28T07:55:01.136498,04fa091a2f743d7b,Emory Healthcare,ehccareers-emory.icims.com,ehccareers-emory,university_hospital,icims
1642651,163105,Food & Nutrition Associate,Food Services,US-GA-Atlanta,,,,,,2026-03-27T04:13:00,https://ehccareers-emory.icims.com/jobs/jobs/163105/job,,,2026-03-28T07:55:01.136015,063a09ecb56b1ed3,Emory Healthcare,ehccareers-emory.icims.com,ehccareers-emory,university_hospital,icims
1706197,330314,Senior Software Developer - Data Analytics - US Citizenship Required,,United States,,,,,,2026-03-27T00:00:00,https://eeho.fa.us2.oraclecloud.com/hcmUI/CandidateExperience/en/sites/CX_1/job/330314,,,2026-03-27T07:19:57.998129,770daed157e1cd20,Oracle (EEHO),eeho,eeho,,oracle
1532565,329964,Software Developer 5,,United States,,,,,,2026-03-27T00:00:00,https://eeho.fa.us2.oraclecloud.com/hcmUI/CandidateExperience/en/sites/CX_1/job/329964,,,2026-03-28T07:11:05.104347,e75c4274e246a237,Oracle (EEHO),eeho,eeho,,oracle
1532564,329957,Software Developer 4,,United States,,,,,,2026-03-27T00:00:00,https://eeho.fa.us2.oraclecloud.com/hcmUI/CandidateExperience/en/sites/CX_1/job/329957,,,2026-03-28T07:11:05.104331,854816a0b1f01a2d,Oracle (EEHO),eeho,eeho,,oracle
1532563,329956,Software Developer 3,,United States,,,,,,2026-03-27T00:00:00,https://eeho.fa.us2.oraclecloud.com/hcmUI/CandidateExperience/en/sites/CX_1/job/329956,,,2026-03-28T07:11:05.104313,d233030eba44ae48,Oracle (EEHO),eeho,eeho,,oracle
