id,external_id,title,department,location,state,city,job_type,salary_min,salary_max,posted_date,url,description,qualifications,scraped_at,unique_key,company_name,subdomain,portal_slug,sector,ats_type
2815,141573,RN - Stepdown - Los Alamitos - Per Diem Days,,Los Alamitos Med Ctr - Floor 2,,,PER_DIEM,86.91,,2026-03-12T20:00:00+00:00,https://jobs.uci.edu/jobs/141573,"Who We Are UCI Health is the clinical enterprise of the University of California, Irvine, and the only academic health system based in Orange County. UCI Health is comprised of its main campus, UCI Medical Center, a 459-bed, acute care hospital in in Orange, Calif., four hospitals and affiliated physicians of the UCI Health Community Network in Orange and Los Angeles counties and ambulatory care centers across the region. Listed among America’s Best Hospitals by U.S. News & World Report for 23 consecutive years, UCI Medical Center provides tertiary and quaternary care and is home to Orange County’s only National Cancer Institute-designated comprehensive cancer center, high-risk perinatal/neonatal program and American College of Surgeons-verified Level I adult and Level II pediatric trauma center, gold level 1 geriatric emergency department and regional burn center. UCI Health serves a region of nearly 4 million people in Orange County, western Riverside County and southeast Los Angeles County. To learn more about UCI Health, visit www.ucihealth.org. Your Role on the Team Position Summary: Orientates to the planning and provision of nursing care to patients in the step down unit. Accurately interprets ECG rhythm and manages care of patients during life threatening emergencies in population served. Orientates to the supervision and delegation of care responsibilities to ancillary personnel commensurate with their scope of practice. What It Takes to be Successful Required Qualifications: Current California Registered Nurse license. AHA Basic Life Support (BLS) AHA Advanced Cardiac Life Support (ACLS) All external candidates must have a Bachelor of Science in Nursing Must possess the skill, knowledge and ability essential to the successful performance of assigned duties Must demonstrate customer service skills appropriate to the job Excellent written and verbal communication skills in English Ability to maintain a work pace appropriate to the workload Ability to establish and maintain effective working relationships across the Health System Preferred Qualifications: Knowledge of University and medical center organizations, policies, procedures and forms Complete of Critical Care Course. Required cardiovascular nursing knowledge of skills applicable to the care of post-coronary intervention and open heart patients during their rehab & discharge phase of their hospitalization. Excellent observation skills, good nursing judgement/critical thinking, and oral and written communication skills. Ability to work with multiple tasks in a team setting utilizing interpersonal, organizational and prioritizing skills. Able to supervise and delegate care responsibilities to ancillary personnel in proportion with their scope of practice. Total Rewards We offer a wealth of benefits to make working at UCI even more rewarding. These benefits may include medical insurance, sick and vacation time, retirement savings plans, and access to a number of discounts and perks. Please utilize the links listed here to learn more about our compensation practices and benefits. Conditions of Employment: The University of California, Irvine (UCI) seeks to provide a safe and healthy environment for the entire UCI community. As part of this commitment, all applicants who accept an offer of employment must comply with the following conditions of employment: Background Check and Live Scan Employment Misconduct* Legal Right to Work in the United States Vaccination Policies Smoking and Tobacco Policy Drug Free Environment *Misconduct Disclosure Requirement: As a condition of employment, the final candidate who accepts a conditional offer of employment will be required to disclose if they have been subject to any final administrative or judicial decisions within the last seven years determining that they committed any misconduct; received notice of any allegations or are currently the subject of any administrative or disciplinary proceedings involving misconduct; have left a position after receiving notice of allegations or while under investigation in an administrative or disciplinary proceeding involving misconduct; or have filed an appeal of a finding of misconduct with a previous employer. The following additional conditions may apply, some of which are dependent upon business unit or job specific requirements. California Child Abuse and Neglect Reporting Act E-Verify Pre-Placement Health Evaluation Details of each policy may be reviewed by visiting the following page: https://hr.uci.edu/new-hire/conditions-of-employment.php Closing Statement: The University of California is an Equal Opportunity Employer. All qualified applicants will receive consideration for employment without regard to race, color, religion, sex, sexual orientation, gender identity, national origin, disability, age, protected veteran status, or other protected categories covered by the UC Anti-Discrimination Policy. We are committed to attracting and retaining a diverse workforce along with honoring unique experiences, perspectives, and identities. Together, our community strives to create and maintain working and learning environments that are inclusive, equitable, and welcoming. UCI provides reasonable accommodations for applicants with disabilities upon request. For more information, please contact UCI's Employee Experience Center (EEC) at eec@uci.edu or at (949) 824-0500, Monday - Friday from 8:30 a.m. - 5:00 p.m. Consideration for Work Authorization Sponsorship Must be able to provide proof of work authorization","Required Qualifications: Current California Registered Nurse license. AHA Basic Life Support (BLS) AHA Advanced Cardiac Life Support (ACLS) All external candidates must have a Bachelor of Science in Nursing Must possess the skill, knowledge and ability essential to the successful performance of assigned duties Must demonstrate customer service skills appropriate to the job Excellent written and verbal communication skills in English Ability to maintain a work pace appropriate to the workload Ability to establish and maintain effective working relationships across the Health System Preferred Qualifications: Knowledge of University and medical center organizations, policies, procedures and forms Complete of Critical Care Course. Required cardiovascular nursing knowledge of skills applicable to the care of post-coronary intervention and open heart patients during their rehab & discharge phase of their hospitalization. Excellent observation skills, good nursing judgement/critical thinking, and oral and written communication skills. Ability to work with multiple tasks in a team setting utilizing interpersonal, organizational and prioritizing skills. Able to supervise and delegate care responsibilities to ancillary personnel in proportion with their scope of practice. Total Rewards We offer a wealth of benefits to make working at UCI even more rewarding. These benefits may include medical insurance, sick and vacation time, retirement savings plans, and access to a number of discounts and perks. Please utilize the links listed here to learn more about our compensation practices and benefits. Conditions of Employment: The University of California, Irvine (UCI) seeks to provide a safe and healthy environment for the entire UCI community. As part of this commitment, all applicants who accept an offer of employment must comply with the following conditions of employment: Background Check and Live Scan Employment Misconduct* Legal Right to Work in the United States Vaccination Policies Smoking and Tobacco Policy Drug Free Environment *Misconduct Disclosure Requirement: As a condition of employment, the final candidate who accepts a conditional offer of employment will be required to disclose if they have been subject to any final administrative or judicial decisions within the last seven years determining that they committed any misconduct; received notice of any allegations or are currently the subject of any administrative or disciplinary proceedings involving misconduct; have left a position after receiving notice of allegations or while under investigation in an administrative or disciplinary proceeding involving misconduct; or have filed an appeal of a finding of misconduct with a previous employer. The following additional conditions may apply, some of which are dependent upon business unit or job specific requirements. California Child Abuse and Neglect Reporting Act E-Verify Pre-Placement Health Evaluation Details of each policy may be reviewed by visiting the following page: https://hr.uci.edu/new-hire/conditions-of-employment.php Closing Statement: The University of California is an Equal Opportunity Employer. All qualified applicants will receive consideration for employment without regard to race, color, religion, sex, sexual orientation, gender identity, national origin, disability, age, protected veteran status, or other protected categories covered by the UC Anti-Discrimination Policy. We are committed to attracting and retaining a diverse workforce along with honoring unique experiences, perspectives, and identities. Together, our community strives to create and maintain working and learning environments that are inclusive, equitable, and welcoming. UCI provides reasonable accommodations for applicants with disabilities upon request. For more information, please contact UCI's Employee Experience Center (EEC) at eec@uci.edu or at (949) 824-0500, Monday - Friday from 8:30 a.m. - 5:00 p.m.",2026-03-12T21:19:08.801181,ae4e8d330994e7a2,UC Irvine Health,uci.icims.com,uci,university_hospital,icims
2814,141574,RN - Med Acute - Fountain Valley - FT Days,,East Tower - Floor 4,,,FULL_TIME,67.55,,2026-03-12T19:59:00+00:00,https://jobs.uci.edu/jobs/141574,"Who We Are UCI Health is the clinical enterprise of the University of California, Irvine, and the only academic health system based in Orange County. UCI Health is comprised of its main campus, UCI Medical Center, a 459-bed, acute care hospital in in Orange, Calif., four hospitals and affiliated physicians of the UCI Health Community Network in Orange and Los Angeles counties and ambulatory care centers across the region. Listed among America’s Best Hospitals by U.S. News & World Report for 23 consecutive years, UCI Medical Center provides tertiary and quaternary care and is home to Orange County’s only National Cancer Institute-designated comprehensive cancer center, high-risk perinatal/neonatal program and American College of Surgeons-verified Level I adult and Level II pediatric trauma center, gold level 1 geriatric emergency department and regional burn center. UCI Health serves a region of nearly 4 million people in Orange County, western Riverside County and southeast Los Angeles County. To learn more about UCI Health, visit www.ucihealth.org. Your Role on the Team Position Summary: The Medical Acute registered nurse provides direct patient care, in accordance with the Nurse Practice Act, to assigned patients in the Medical Acute units. The registered nurse is supportive, compassionate, efficient, detail-oriented team player with excellent interpersonal skills and who collaboratively maintains plan of care for vulnerable patients. What It Takes to be Successful Required Qualifications: All External Candidates must have a Bachelor of Science in Nursing Current California RN license Current American Heart Association BLS Current ONS/ONCC Chemotherapy/Immunotherapy Certificate Initial Dysrhythmia Recognition and NIHSS within 90 days of hire One year experience as a Telemetry RN. Must possess the skill, knowledge and ability essential to the successful performance of assigned duties Must demonstrate customer service skills appropriate to the job Excellent written and verbal communication skills in English Ability to maintain a work pace appropriate to the workload Ability to establish and maintain effective working relationships across the Health System Preferred Qualifications: Preferred: Recent Acute Care experience in Telemetry Knowledge of University and medical center organizations, policies, procedures and forms Total Rewards We offer a wealth of benefits to make working at UCI even more rewarding. These benefits may include medical insurance, sick and vacation time, retirement savings plans, and access to a number of discounts and perks. Please utilize the links listed here to learn more about our compensation practices and benefits. Conditions of Employment: The University of California, Irvine (UCI) seeks to provide a safe and healthy environment for the entire UCI community. As part of this commitment, all applicants who accept an offer of employment must comply with the following conditions of employment: Background Check and Live Scan Employment Misconduct* Legal Right to Work in the United States Vaccination Policies Smoking and Tobacco Policy Drug Free Environment *Misconduct Disclosure Requirement: As a condition of employment, the final candidate who accepts a conditional offer of employment will be required to disclose if they have been subject to any final administrative or judicial decisions within the last seven years determining that they committed any misconduct; received notice of any allegations or are currently the subject of any administrative or disciplinary proceedings involving misconduct; have left a position after receiving notice of allegations or while under investigation in an administrative or disciplinary proceeding involving misconduct; or have filed an appeal of a finding of misconduct with a previous employer. The following additional conditions may apply, some of which are dependent upon business unit or job specific requirements. California Child Abuse and Neglect Reporting Act E-Verify Pre-Placement Health Evaluation Details of each policy may be reviewed by visiting the following page: https://hr.uci.edu/new-hire/conditions-of-employment.php Closing Statement: The University of California is an Equal Opportunity Employer. All qualified applicants will receive consideration for employment without regard to race, color, religion, sex, sexual orientation, gender identity, national origin, disability, age, protected veteran status, or other protected categories covered by the UC Anti-Discrimination Policy. We are committed to attracting and retaining a diverse workforce along with honoring unique experiences, perspectives, and identities. Together, our community strives to create and maintain working and learning environments that are inclusive, equitable, and welcoming. UCI provides reasonable accommodations for applicants with disabilities upon request. For more information, please contact UCI's Employee Experience Center (EEC) at eec@uci.edu or at (949) 824-0500, Monday - Friday from 8:30 a.m. - 5:00 p.m. Consideration for Work Authorization Sponsorship Must be able to provide proof of work authorization","Required Qualifications: All External Candidates must have a Bachelor of Science in Nursing Current California RN license Current American Heart Association BLS Current ONS/ONCC Chemotherapy/Immunotherapy Certificate Initial Dysrhythmia Recognition and NIHSS within 90 days of hire One year experience as a Telemetry RN. Must possess the skill, knowledge and ability essential to the successful performance of assigned duties Must demonstrate customer service skills appropriate to the job Excellent written and verbal communication skills in English Ability to maintain a work pace appropriate to the workload Ability to establish and maintain effective working relationships across the Health System Preferred Qualifications: Preferred: Recent Acute Care experience in Telemetry Knowledge of University and medical center organizations, policies, procedures and forms Total Rewards We offer a wealth of benefits to make working at UCI even more rewarding. These benefits may include medical insurance, sick and vacation time, retirement savings plans, and access to a number of discounts and perks. Please utilize the links listed here to learn more about our compensation practices and benefits. Conditions of Employment: The University of California, Irvine (UCI) seeks to provide a safe and healthy environment for the entire UCI community. As part of this commitment, all applicants who accept an offer of employment must comply with the following conditions of employment: Background Check and Live Scan Employment Misconduct* Legal Right to Work in the United States Vaccination Policies Smoking and Tobacco Policy Drug Free Environment *Misconduct Disclosure Requirement: As a condition of employment, the final candidate who accepts a conditional offer of employment will be required to disclose if they have been subject to any final administrative or judicial decisions within the last seven years determining that they committed any misconduct; received notice of any allegations or are currently the subject of any administrative or disciplinary proceedings involving misconduct; have left a position after receiving notice of allegations or while under investigation in an administrative or disciplinary proceeding involving misconduct; or have filed an appeal of a finding of misconduct with a previous employer. The following additional conditions may apply, some of which are dependent upon business unit or job specific requirements. California Child Abuse and Neglect Reporting Act E-Verify Pre-Placement Health Evaluation Details of each policy may be reviewed by visiting the following page: https://hr.uci.edu/new-hire/conditions-of-employment.php Closing Statement: The University of California is an Equal Opportunity Employer. All qualified applicants will receive consideration for employment without regard to race, color, religion, sex, sexual orientation, gender identity, national origin, disability, age, protected veteran status, or other protected categories covered by the UC Anti-Discrimination Policy. We are committed to attracting and retaining a diverse workforce along with honoring unique experiences, perspectives, and identities. Together, our community strives to create and maintain working and learning environments that are inclusive, equitable, and welcoming. UCI provides reasonable accommodations for applicants with disabilities upon request. For more information, please contact UCI's Employee Experience Center (EEC) at eec@uci.edu or at (949) 824-0500, Monday - Friday from 8:30 a.m. - 5:00 p.m.",2026-03-12T21:19:08.799945,6e2aa17795ce862b,UC Irvine Health,uci.icims.com,uci,university_hospital,icims
